{
  "@id": "https://repo.metadatacenter.orgx/templates/82011b99-6784-458d-97ad-7438ca8f04c1",
  "@type": "https://schema.metadatacenter.org/core/Template",
  "@context": {
    "xsd": "http://www.w3.org/2001/XMLSchema#",
    "pav": "http://purl.org/pav/",
    "oslc": "http://open-services.net/ns/core#",
    "bibo": "http://purl.org/ontology/bibo/",
    "schema": "http://schema.org/",
    "schema:name": {
      "@type": "xsd:string"
    },
    "schema:description": {
      "@type": "xsd:string"
    },
    "pav:createdOn": {
      "@type": "xsd:dateTime"
    },
    "pav:createdBy": {
      "@type": "@id"
    },
    "pav:lastUpdatedOn": {
      "@type": "xsd:dateTime"
    },
    "oslc:modifiedBy": {
      "@type": "@id"
    }
  },
  "type": "object",
  "schema:name": "Single-Field Template",
  "schema:description": "Description",
  "title": "Single-field template template schema",
  "description": "Single-field template template schema autogenerated by the CEDAR Template Editor 1.0.7-SNAPSHOT",
  "_ui": {
    "order": [
      "study:name"
    ],
    "propertyLabels": {},
    "propertyDescriptions": {}
  },
  "properties": {
    "@context": {
      "type": "object",
      "properties": {
        "rdfs": {
          "type": "string",
          "format": "uri",
          "enum": [
            "http://www.w3.org/2000/01/rdf-schema#"
          ]
        },
        "xsd": {
          "type": "string",
          "format": "uri",
          "enum": [
            "http://www.w3.org/2001/XMLSchema#"
          ]
        },
        "pav": {
          "type": "string",
          "format": "uri",
          "enum": [
            "http://purl.org/pav/"
          ]
        },
        "schema": {
          "type": "string",
          "format": "uri",
          "enum": [
            "http://schema.org/"
          ]
        },
        "oslc": {
          "type": "string",
          "format": "uri",
          "enum": [
            "http://open-services.net/ns/core#"
          ]
        },
        "skos": {
          "type": "string",
          "format": "uri",
          "enum": [
            "http://www.w3.org/2004/02/skos/core#"
          ]
        },
        "rdfs:label": {
          "type": "object",
          "properties": {
            "@type": {
              "type": "string",
              "enum": [
                "xsd:string"
              ]
            }
          }
        },
        "schema:isBasedOn": {
          "type": "object",
          "properties": {
            "@type": {
              "type": "string",
              "enum": [
                "@id"
              ]
            }
          }
        },
        "schema:name": {
          "type": "object",
          "properties": {
            "@type": {
              "type": "string",
              "enum": [
                "xsd:string"
              ]
            }
          }
        },
        "schema:description": {
          "type": "object",
          "properties": {
            "@type": {
              "type": "string",
              "enum": [
                "xsd:string"
              ]
            }
          }
        },
        "pav:createdOn": {
          "type": "object",
          "properties": {
            "@type": {
              "type": "string",
              "enum": [
                "xsd:dateTime"
              ]
            }
          }
        },
        "pav:createdBy": {
          "type": "object",
          "properties": {
            "@type": {
              "type": "string",
              "enum": [
                "@id"
              ]
            }
          }
        },
        "pav:lastUpdatedOn": {
          "type": "object",
          "properties": {
            "@type": {
              "type": "string",
              "enum": [
                "xsd:dateTime"
              ]
            }
          }
        },
        "oslc:modifiedBy": {
          "type": "object",
          "properties": {
            "@type": {
              "type": "string",
              "enum": [
                "@id"
              ]
            }
          }
        },
        "skos:notation": {
          "type": "object",
          "properties": {
            "@type": {
              "type": "string",
              "enum": [
                "xsd:string"
              ]
            }
          }
        },
        "pav:derivedFrom": {
          "type": "object",
          "properties": {
            "@type": {
              "type": "string",
              "enum": [
                "@id"
              ]
            }
          }
        },
        "study:name": {
          "enum": [
            "https://schema.metadatacenter.orgx/properties/studyName"
          ]
        }
      },
      "required": [
        "xsd",
        "rdfs",
        "schema",
        "oslc",
        "pav",
        "skos",
        "rdfs:label",
        "schema:isBasedOn",
        "schema:name",
        "schema:description",
        "pav:createdOn",
        "pav:createdBy",
        "pav:lastUpdatedOn",
        "oslc:modifiedBy",
        "skos:notation",
        "study:name"
      ],
      "additionalProperties": false
    },
    "@id": {
      "type": [
        "string",
        "null"
      ],
      "format": "uri"
    },
    "@type": {
      "oneOf": [
        {
          "type": "string",
          "format": "uri"
        },
        {
          "type": "array",
          "minItems": 1,
          "items": {
            "type": "string",
            "format": "uri"
          },
          "uniqueItems": true
        }
      ]
    },
    "schema:isBasedOn": {
      "type": "string",
      "format": "uri"
    },
    "schema:name": {
      "type": "string",
      "minLength": 1
    },
    "schema:description": {
      "type": "string"
    },
    "pav:createdOn": {
      "type": [
        "string",
        "null"
      ],
      "format": "date-time"
    },
    "pav:createdBy": {
      "type": [
        "string",
        "null"
      ],
      "format": "uri"
    },
    "pav:lastUpdatedOn": {
      "type": [
        "string",
        "null"
      ],
      "format": "date-time"
    },
    "oslc:modifiedBy": {
      "type": [
        "string",
        "null"
      ],
      "format": "uri"
    },
    "pav:derivedFrom": {
      "type": "string",
      "format": "uri"
    },
    "study:name": {
      "@type": "https://schema.metadatacenter.org/core/TemplateField",
      "@context": {
        "xsd": "http://www.w3.org/2001/XMLSchema#",
        "pav": "http://purl.org/pav/",
        "oslc": "http://open-services.net/ns/core#",
        "schema": "http://schema.org/",
        "skos": "http://www.w3.org/2004/02/skos/core#",
        "schema:name": {
          "@type": "xsd:string"
        },
        "schema:description": {
          "@type": "xsd:string"
        },
        "skos:prefLabel": {
          "@type": "xsd:string"
        },
        "skos:altLabel": {
          "@type": "xsd:string"
        },
        "pav:createdOn": {
          "@type": "xsd:dateTime"
        },
        "pav:createdBy": {
          "@type": "@id"
        },
        "pav:lastUpdatedOn": {
          "@type": "xsd:dateTime"
        },
        "oslc:modifiedBy": {
          "@type": "@id"
        }
      },
      "type": "object",
      "schema:name": "Study Name",
      "schema:description": "",
      "title": "Study name field schema",
      "description": "Study name field schema autogenerated by the CEDAR Template Editor",
      "_ui": {
        "inputType": "textfield"
      },
      "_valueConstraints": {
        "requiredValue": true
      },
      "properties": {
        "@type": {
          "oneOf": [
            {
              "type": "string",
              "format": "uri"
            },
            {
              "type": "array",
              "minItems": 1,
              "items": {
                "type": "string",
                "format": "uri"
              },
              "uniqueItems": true
            }
          ]
        },
        "@value": {
          "type": [
            "string",
            "null"
          ]
        },
        "rdfs:label": {
          "type": [
            "string",
            "null"
          ]
        }
      },
      "required": [
        "@value"
      ],
      "pav:createdOn": "2017-05-19T11:47:46-0700",
      "pav:createdBy": "https://metadatacenter.org/users/67a894dc-e9df-42d0-bb6e-5dbb4aa9dd79",
      "pav:lastUpdatedOn": "2017-05-19T11:47:46-0700",
      "oslc:modifiedBy": "https://metadatacenter.org/users/67a894dc-e9df-42d0-bb6e-5dbb4aa9dd79",
      "schema:schemaVersion": "1.6.0",
      "additionalProperties": false,
      "@id": "https://repo.metadatacenter.orgx/template-fields/ef0927d6-1ca1-48c5-944a-5a6cebb4201e",
      "$schema": "http://json-schema.org/draft-04/schema#"
    }
  },
  "required": [
    "@context",
    "@id",
    "schema:isBasedOn",
    "schema:name",
    "schema:description",
    "pav:createdOn",
    "pav:createdBy",
    "pav:lastUpdatedOn",
    "oslc:modifiedBy",
    "study:name"
  ],
  "pav:createdOn": "2017-05-19T11:47:46-0700",
  "pav:createdBy": "https://metadatacenter.org/users/67a894dc-e9df-42d0-bb6e-5dbb4aa9dd79",
  "pav:lastUpdatedOn": "2017-05-19T11:47:46-0700",
  "oslc:modifiedBy": "https://metadatacenter.org/users/67a894dc-e9df-42d0-bb6e-5dbb4aa9dd79",
  "schema:schemaVersion": "1.6.0",
  "bibo:status": "bibo:draft",
  "pav:version": "0.0.1",
  "additionalProperties": false,
  "$schema": "http://json-schema.org/draft-04/schema#"
}
