{
  "@id": "https://repo.staging.metadatacenter.org/templates/671611bc-e560-494e-8326-50b7ae6602b7",
  "@type": "https://schema.metadatacenter.org/core/Template",
  "@context": {
    "xsd": "http://www.w3.org/2001/XMLSchema#",
    "pav": "http://purl.org/pav/",
    "bibo": "http://purl.org/ontology/bibo/",
    "oslc": "http://open-services.net/ns/core#",
    "schema": "http://schema.org/",
    "schema:name": {
      "@type": "xsd:string"
    },
    "schema:description": {
      "@type": "xsd:string"
    },
    "pav:createdOn": {
      "@type": "xsd:dateTime"
    },
    "pav:createdBy": {
      "@type": "@id"
    },
    "pav:lastUpdatedOn": {
      "@type": "xsd:dateTime"
    },
    "oslc:modifiedBy": {
      "@type": "@id"
    }
  },
  "type": "object",
  "title": "Static field template template schema",
  "description": "Static field template template schema generated by the CEDAR Template Editor 2.1.11",
  "_ui": {
    "order": [
      "About Study Form"
    ],
    "propertyLabels": {
      "About Study Form": "About Study Form"
    },
    "propertyDescriptions": {
      "About Study Form": "Help Text"
    }
  },
  "properties": {
    "@context": {
      "type": "object",
      "properties": {
        "rdfs": {
          "type": "string",
          "format": "uri",
          "enum": [
            "http://www.w3.org/2000/01/rdf-schema#"
          ]
        },
        "xsd": {
          "type": "string",
          "format": "uri",
          "enum": [
            "http://www.w3.org/2001/XMLSchema#"
          ]
        },
        "pav": {
          "type": "string",
          "format": "uri",
          "enum": [
            "http://purl.org/pav/"
          ]
        },
        "schema": {
          "type": "string",
          "format": "uri",
          "enum": [
            "http://schema.org/"
          ]
        },
        "oslc": {
          "type": "string",
          "format": "uri",
          "enum": [
            "http://open-services.net/ns/core#"
          ]
        },
        "skos": {
          "type": "string",
          "format": "uri",
          "enum": [
            "http://www.w3.org/2004/02/skos/core#"
          ]
        },
        "rdfs:label": {
          "type": "object",
          "properties": {
            "@type": {
              "type": "string",
              "enum": [
                "xsd:string"
              ]
            }
          }
        },
        "schema:isBasedOn": {
          "type": "object",
          "properties": {
            "@type": {
              "type": "string",
              "enum": [
                "@id"
              ]
            }
          }
        },
        "schema:name": {
          "type": "object",
          "properties": {
            "@type": {
              "type": "string",
              "enum": [
                "xsd:string"
              ]
            }
          }
        },
        "schema:description": {
          "type": "object",
          "properties": {
            "@type": {
              "type": "string",
              "enum": [
                "xsd:string"
              ]
            }
          }
        },
        "pav:createdOn": {
          "type": "object",
          "properties": {
            "@type": {
              "type": "string",
              "enum": [
                "xsd:dateTime"
              ]
            }
          }
        },
        "pav:createdBy": {
          "type": "object",
          "properties": {
            "@type": {
              "type": "string",
              "enum": [
                "@id"
              ]
            }
          }
        },
        "pav:lastUpdatedOn": {
          "type": "object",
          "properties": {
            "@type": {
              "type": "string",
              "enum": [
                "xsd:dateTime"
              ]
            }
          }
        },
        "oslc:modifiedBy": {
          "type": "object",
          "properties": {
            "@type": {
              "type": "string",
              "enum": [
                "@id"
              ]
            }
          }
        },
        "skos:notation": {
          "type": "object",
          "properties": {
            "@type": {
              "type": "string",
              "enum": [
                "xsd:string"
              ]
            }
          }
        },
        "pav:derivedFrom": {
          "type": "object",
          "properties": {
            "@type": {
              "type": "string",
              "enum": [
                "@id"
              ]
            }
          }
        }
      },
      "required": [
        "xsd",
        "pav",
        "schema",
        "oslc",
        "schema:isBasedOn",
        "schema:name",
        "schema:description",
        "pav:createdOn",
        "pav:createdBy",
        "pav:lastUpdatedOn",
        "oslc:modifiedBy"
      ],
      "additionalProperties": false
    },
    "@id": {
      "type": [
        "string",
        "null"
      ],
      "format": "uri"
    },
    "@type": {
      "oneOf": [
        {
          "type": "string",
          "format": "uri"
        },
        {
          "type": "array",
          "minItems": 1,
          "items": {
            "type": "string",
            "format": "uri"
          },
          "uniqueItems": true
        }
      ]
    },
    "schema:isBasedOn": {
      "type": "string",
      "format": "uri"
    },
    "schema:name": {
      "type": "string",
      "minLength": 1
    },
    "schema:description": {
      "type": "string"
    },
    "pav:createdOn": {
      "type": [
        "string",
        "null"
      ],
      "format": "date-time"
    },
    "pav:createdBy": {
      "type": [
        "string",
        "null"
      ],
      "format": "uri"
    },
    "pav:lastUpdatedOn": {
      "type": [
        "string",
        "null"
      ],
      "format": "date-time"
    },
    "oslc:modifiedBy": {
      "type": [
        "string",
        "null"
      ],
      "format": "uri"
    },
    "pav:derivedFrom": {
      "type": "string",
      "format": "uri"
    },
    "About Study Form": {
      "$schema": "http://json-schema.org/draft-04/schema#",
      "@id": "tmp-1542048003093-1835270",
      "@type": "https://schema.metadatacenter.org/core/StaticTemplateField",
      "@context": {
        "schema": "http://schema.org/",
        "pav": "http://purl.org/pav/",
        "bibo": "http://purl.org/ontology/bibo/",
        "oslc": "http://open-services.net/ns/core#"
      },
      "type": "object",
      "title": "About Study Form field schema",
      "description": "About Study Form field schema generated by the CEDAR Template Editor 2.1.11",
      "_ui": {
        "inputType": "richtext",
        "_content": "<p><i style=\"color: rgb(34, 34, 34); font-family: sans-serif; background-color: rgb(255, 255, 255);\">Lorem ipsum dolor sit amet, consectetur adipiscing elit, sed do eiusmod tempor incididunt ut labore et dolore magna aliqua. Ut enim ad minim veniam, quis nostrud exercitation ullamco laboris nisi ut aliquip ex ea commodo consequat. Duis aute irure dolor in reprehenderit in voluptate velit esse cillum dolore eu fugiat nulla pariatur. Excepteur sint occaecat cupidatat non proident, sunt in culpa qui officia deserunt mollit anim id est laborum.</i></p>\n"
      },
      "pav:createdOn": null,
      "pav:createdBy": null,
      "pav:lastUpdatedOn": null,
      "oslc:modifiedBy": null,
      "schema:schemaVersion": "1.6.0",
      "schema:description": "Help Text",
      "additionalProperties": false,
      "schema:name": "About Study Form"
    }
  },
  "required": [
    "@context",
    "@id",
    "schema:isBasedOn",
    "schema:name",
    "schema:description",
    "pav:createdOn",
    "pav:createdBy",
    "pav:lastUpdatedOn",
    "oslc:modifiedBy"
  ],
  "schema:name": "Static Field Template",
  "schema:description": "",
  "pav:createdOn": "2018-11-12T10:38:57-0800",
  "pav:createdBy": "https://metadatacenter.org/users/018bbf94-f8e4-4e0e-946d-341698f70245",
  "pav:lastUpdatedOn": "2018-11-12T10:38:57-0800",
  "oslc:modifiedBy": "https://metadatacenter.org/users/018bbf94-f8e4-4e0e-946d-341698f70245",
  "schema:schemaVersion": "1.6.0",
  "additionalProperties": false,
  "pav:version": "0.0.1",
  "bibo:status": "bibo:draft",
  "$schema": "http://json-schema.org/draft-04/schema#"
}
